title,link,published,source
The US Is Storing Migrant Children’s DNA in a Criminal Database,https://www.wired.com/story/cbp-dna-migrant-children-fbi-codis/,"Thu, 29 May 2025 10:30:00 +0000",https://www.wired.com/feed/rss
The Plan to Send Plant-Filled ‘Gardens’ Into Orbit,https://www.wired.com/story/the-plan-to-build-the-first-garden-in-space-thomas-heatherwick-studio-aurelia/,"Thu, 29 May 2025 10:00:00 +0000",https://www.wired.com/feed/rss
Starship’s Latest Test Reveals New Problems for SpaceX to Solve,https://www.wired.com/story/starships-latest-test-reveals-new-problems-for-spacex-to-solve/,"Thu, 29 May 2025 09:30:00 +0000",https://www.wired.com/feed/rss
Hummingbirds Are Evolving to Adapt to Life With Humans,https://www.wired.com/story/hummingbirds-are-evolving-to-adapt-to-life-with-humans/,"Thu, 29 May 2025 09:00:00 +0000",https://www.wired.com/feed/rss
Elon Musk Says He'll Step Back From the Government. DOGE Isn't Going Anywhere,https://www.wired.com/story/elon-musk-stepping-back-doge-final-form/,"Thu, 29 May 2025 08:38:06 +0000",https://www.wired.com/feed/rss
Why Anthropic’s New AI Model Sometimes Tries to ‘Snitch’,https://www.wired.com/story/anthropic-claude-snitch-emergent-behavior/,"Wed, 28 May 2025 19:40:45 +0000",https://www.wired.com/feed/rss
"10 Best Juicers (2025): Centrifugal, Slow, Masticating",https://www.wired.com/gallery/best-juicer/,"Wed, 28 May 2025 17:49:33 +0000",https://www.wired.com/feed/rss
Nancy Mace’s Former Staff Claim She Had Them Create Burner Accounts to Promote Her,https://www.wired.com/story/nancy-mace-former-staff-burner-accounts/,"Wed, 28 May 2025 16:11:51 +0000",https://www.wired.com/feed/rss
‘Grand Theft Auto’ Publisher Swaps DEI for ‘Diversity of Thought’ in Annual Report,https://www.wired.com/story/grand-theft-autos-publisher-abandons-dei-for-diversity-of-thought-in-annual-report/,"Wed, 28 May 2025 15:51:08 +0000",https://www.wired.com/feed/rss
"The Best E-Readers, Tested and Reviewed (2025)",https://www.wired.com/gallery/best-ereaders/,"Wed, 28 May 2025 15:00:00 +0000",https://www.wired.com/feed/rss
All the Top Features in MacOS Sequoia,https://www.wired.com/story/apple-macos-sequoia-features/,"Wed, 28 May 2025 14:00:00 +0000",https://www.wired.com/feed/rss
"10 Best Meal Delivery Services, Tested By an Ex-Restaurant Critic",https://www.wired.com/gallery/best-meal-kit-services-1/,"Wed, 28 May 2025 13:50:28 +0000",https://www.wired.com/feed/rss
The Top New Features in Apple’s iOS 18 and iPadOS 18,https://www.wired.com/story/apple-iphone-ios-18-ipados-18-new-features/,"Wed, 28 May 2025 13:30:00 +0000",https://www.wired.com/feed/rss
7 Best Massagers for People Who Don’t Have Time to Relax (2025),https://www.wired.com/gallery/the-best-massagers/,"Wed, 28 May 2025 13:02:00 +0000",https://www.wired.com/feed/rss
Mushroom Supplements Are the Biohackers’ Latest Fix (2025),https://www.wired.com/story/the-wired-guide-to-mushroom-supplements/,"Wed, 28 May 2025 12:02:00 +0000",https://www.wired.com/feed/rss
Jesse Armstrong Finds Sympathy for ‘Rich Assholes’ in Mountainhead,https://www.wired.com/story/jesse-armstrong-mountainhead/,"Wed, 28 May 2025 11:00:00 +0000",https://www.wired.com/feed/rss
"7 Best Cheap Mattresses (2025), Tested and Reviewed",https://www.wired.com/gallery/best-cheap-mattresses/,"Wed, 28 May 2025 10:39:00 +0000",https://www.wired.com/feed/rss
The Switch 2 May Signal the End of Physical Games,https://www.wired.com/story/the-switch-2-may-signal-the-end-of-physical-games/,"Wed, 28 May 2025 10:30:00 +0000",https://www.wired.com/feed/rss
Auto Shanghai 2025 Wasn’t Just a Car Show. It Was a Warning to the West,https://www.wired.com/story/auto-shanghai-2025-car-show-warning-to-the-west/,"Wed, 28 May 2025 10:26:27 +0000",https://www.wired.com/feed/rss
30% Off Design Within Reach Promo Code | June 2025,https://www.wired.com/story/design-within-reach-promo-code/,"Wed, 28 May 2025 05:40:00 +0000",https://www.wired.com/feed/rss
Home Depot Promo Codes & Coupons: 50% Off,https://www.wired.com/story/home-depot-promo-code/,"Wed, 28 May 2025 05:35:00 +0000",https://www.wired.com/feed/rss
20% HP Coupon Code & Deals | June 2025,https://www.wired.com/story/hp-coupon-code/,"Wed, 28 May 2025 05:30:00 +0000",https://www.wired.com/feed/rss
Adidas Promo Codes & Deals: 15% Off,https://www.wired.com/story/adidas-promo-code/,"Wed, 28 May 2025 05:10:00 +0000",https://www.wired.com/feed/rss
Samsung Promo Codes: 30% Off | June 2025,https://www.wired.com/story/samsung-promo-codes/,"Wed, 28 May 2025 05:05:00 +0000",https://www.wired.com/feed/rss
10% Off Canon Promo Code & Coupons,https://www.wired.com/story/canon-promo-code/,"Wed, 28 May 2025 05:00:00 +0000",https://www.wired.com/feed/rss
The 46 Best Shows on Hulu Right Now (June 2025),https://www.wired.com/story/best-tv-shows-hulu-this-week/,"Tue, 27 May 2025 19:00:00 +0000",https://www.wired.com/feed/rss
Donald Trump’s Media Conglomerate Is Becoming a Bitcoin Reserve,https://www.wired.com/story/donald-trumps-media-conglomerate-is-becoming-a-bitcoin-reserve/,"Tue, 27 May 2025 18:12:43 +0000",https://www.wired.com/feed/rss
Six Moon Designs Lunar Solo Tent Review: An Ultralight Summer Shelter,https://www.wired.com/review/six-moon-designs-lunar-solo-tent/,"Tue, 27 May 2025 14:02:00 +0000",https://www.wired.com/feed/rss
The MagPod Is a Basic Smartphone Tripod I Can’t Live Without,https://www.wired.com/story/the-magpod-is-a-basic-smartphone-tripod-i-cant-live-without/,"Tue, 27 May 2025 13:00:00 +0000",https://www.wired.com/feed/rss
Best AirPods Pro Alternatives: AirPods for Android and More,https://www.wired.com/gallery/best-airpods-alternatives/,"Tue, 27 May 2025 12:33:00 +0000",https://www.wired.com/feed/rss
Ninja Luxe Cafe Premier Espresso Machine Review: Beginner’s Luck,https://www.wired.com/review/luxe-cafe-premier-series-automatic-espresso-machine/,"Tue, 27 May 2025 11:32:00 +0000",https://www.wired.com/feed/rss
Businesses Got Squeezed by Trump’s Tariffs. Now Some of Them Want Their Money Back,https://www.wired.com/story/tariffs-trump-refund-logistics/,"Tue, 27 May 2025 11:00:00 +0000",https://www.wired.com/feed/rss
"The Privacy-Friendly Tech to Replace Your US-Based Email, Browser, and Search",https://www.wired.com/story/the-privacy-friendly-tech-to-replace-your-us-based-email-browser-and-search/,"Tue, 27 May 2025 10:30:00 +0000",https://www.wired.com/feed/rss
Carl Pei Thinks the Phone of the Future Will Only Have One App,https://www.wired.com/story/carl-pei-thinks-the-phone-of-the-future-will-only-have-one-app/,"Tue, 27 May 2025 10:00:00 +0000",https://www.wired.com/feed/rss
There’s a Very Simple Pattern to Elon Musk’s Broken Promises,https://www.wired.com/story/theres-a-very-simple-pattern-to-elon-musks-broken-promises/,"Tue, 27 May 2025 09:30:00 +0000",https://www.wired.com/feed/rss
A New Study Reveals the Makeup of Uranus’ Atmosphere,https://www.wired.com/story/a-new-study-reveals-the-makeup-of-uranus-atmosphere/,"Tue, 27 May 2025 09:00:00 +0000",https://www.wired.com/feed/rss
We Hand-Picked the 72 Best Deals From the 2025 REI Anniversary Sale,https://www.wired.com/story/rei-anniversary-sale-may-2025-1/,"Mon, 26 May 2025 14:07:00 +0000",https://www.wired.com/feed/rss
"The 14 Best TVs We’ve Reviewed, Plus Buying Advice (2025)",https://www.wired.com/gallery/best-tvs/,"Mon, 26 May 2025 12:33:00 +0000",https://www.wired.com/feed/rss
What Is Matter? We Explain the Smart Home Standard (2025),https://www.wired.com/story/what-is-matter/,"Mon, 26 May 2025 12:00:00 +0000",https://www.wired.com/feed/rss
"Hot Farmers, Trad Wives, and an Immigrant Reality Show: Welcome to TV’s MAGA Era",https://www.wired.com/story/hot-farmers-trad-wives-and-an-immigrant-reality-show-welcome-to-tvs-maga-era/,"Mon, 26 May 2025 11:00:00 +0000",https://www.wired.com/feed/rss
Why Women With Type 2 Diabetes Are Diagnosed Later Than Men,https://www.wired.com/story/why-women-with-type-2-diabetes-are-diagnosed-later-than-men/,"Mon, 26 May 2025 11:00:00 +0000",https://www.wired.com/feed/rss
24 Best Memorial Day Mattress and Bedding Sales (2025),https://www.wired.com/story/best-memorial-day-mattress-sales-2025-3/,"Mon, 26 May 2025 10:31:00 +0000",https://www.wired.com/feed/rss
A Starter Guide to Protecting Your Data From Hackers and Corporations,https://www.wired.com/story/guide-protect-data-from-hackers-corporations/,"Mon, 26 May 2025 10:30:00 +0000",https://www.wired.com/feed/rss
39 Best Memorial Day Sales on Our Favorite Gear (2025),https://www.wired.com/story/best-memorial-day-sales-2025-2/,"Mon, 26 May 2025 10:02:00 +0000",https://www.wired.com/feed/rss
Car HUDs Are Bad. Jaguar Land Rover Is Testing Tech to Change That,https://www.wired.com/story/car-huds-are-bad-jaguar-land-rover-is-testing-tech-to-change-that/,"Mon, 26 May 2025 10:00:00 +0000",https://www.wired.com/feed/rss
The Milky Way Has a Mysterious ‘Broken Bone’,https://www.wired.com/story/the-milky-way-has-a-mysterious-broken-bone-nasa/,"Mon, 26 May 2025 09:00:00 +0000",https://www.wired.com/feed/rss
"10 Best Reusable Water Bottles of 2025, Tested & Reviewed",https://www.wired.com/gallery/best-reusable-water-bottles/,"Sun, 25 May 2025 14:02:00 +0000",https://www.wired.com/feed/rss
Samsung Galaxy S25 Edge Review: Super Thin With a Catch,https://www.wired.com/review/samsung-galaxy-s25-edge/,"Sun, 25 May 2025 12:00:00 +0000",https://www.wired.com/feed/rss
The Quest to Prove the Existence of a New Type of Quantum Particle,https://www.wired.com/story/paraparticles-would-be-a-third-kingdom-of-quantum-particle/,"Sun, 25 May 2025 11:00:00 +0000",https://www.wired.com/feed/rss
"3D Is Back. This Time, You Can Ditch the Glasses",https://www.wired.com/story/3d-is-back/,"Sun, 25 May 2025 10:30:00 +0000",https://www.wired.com/feed/rss
"World Faces New Danger of 'Economic Denial' in Climate Fight, Cop30 Head Says",https://news.slashdot.org/story/25/05/28/2048209/world-faces-new-danger-of-economic-denial-in-climate-fight-cop30-head-says?utm_source=rss1.0mainlinkanon&utm_medium=feed,Unknown,https://rss.slashdot.org/Slashdot/slashdot
Astronomers Discover Mystery Cosmic Body Bursting With X-Rays,https://science.slashdot.org/story/25/05/29/0238200/astronomers-discover-mystery-cosmic-body-bursting-with-x-rays?utm_source=rss1.0mainlinkanon&utm_medium=feed,Unknown,https://rss.slashdot.org/Slashdot/slashdot
"Data Broker Giant LexisNexis Says Breach Exposed Personal Information of Over 364,000 People",https://it.slashdot.org/story/25/05/29/0232235/data-broker-giant-lexisnexis-says-breach-exposed-personal-information-of-over-364000-people?utm_source=rss1.0mainlinkanon&utm_medium=feed,Unknown,https://rss.slashdot.org/Slashdot/slashdot
Microsoft Is Opening Windows Update To Third-Party Apps,https://tech.slashdot.org/story/25/05/28/2232237/microsoft-is-opening-windows-update-to-third-party-apps?utm_source=rss1.0mainlinkanon&utm_medium=feed,Unknown,https://rss.slashdot.org/Slashdot/slashdot
"EA Cancels Black Panther Game, Closes Cliffhanger Games",https://games.slashdot.org/story/25/05/28/2226236/ea-cancels-black-panther-game-closes-cliffhanger-games?utm_source=rss1.0mainlinkanon&utm_medium=feed,Unknown,https://rss.slashdot.org/Slashdot/slashdot
Discord's New Currency Pays Users To Interact With Ads,https://news.slashdot.org/story/25/05/28/2221220/discords-new-currency-pays-users-to-interact-with-ads?utm_source=rss1.0mainlinkanon&utm_medium=feed,Unknown,https://rss.slashdot.org/Slashdot/slashdot
Mysterious Database of 184 Million Records Exposes Vast Array of Login Credentials,https://yro.slashdot.org/story/25/05/28/2024243/mysterious-database-of-184-million-records-exposes-vast-array-of-login-credentials?utm_source=rss1.0mainlinkanon&utm_medium=feed,Unknown,https://rss.slashdot.org/Slashdot/slashdot
CD Projekt Red is Moving Forward With Cyberpunk 2,https://games.slashdot.org/story/25/05/28/2018208/cd-projekt-red-is-moving-forward-with-cyberpunk-2?utm_source=rss1.0mainlinkanon&utm_medium=feed,Unknown,https://rss.slashdot.org/Slashdot/slashdot
US Will Ban Foreign Officials To Punish Countries For Social Media Rules,https://yro.slashdot.org/story/25/05/28/201215/us-will-ban-foreign-officials-to-punish-countries-for-social-media-rules?utm_source=rss1.0mainlinkanon&utm_medium=feed,Unknown,https://rss.slashdot.org/Slashdot/slashdot
"Apple Will Announce iOS 26 at WWDC, Not iOS 19",https://apple.slashdot.org/story/25/05/28/1953246/apple-will-announce-ios-26-at-wwdc-not-ios-19?utm_source=rss1.0mainlinkanon&utm_medium=feed,Unknown,https://rss.slashdot.org/Slashdot/slashdot
xAI To Pay Telegram $300 Million To Integrate Grok Into Chat App,https://slashdot.org/story/25/05/28/1946247/xai-to-pay-telegram-300-million-to-integrate-grok-into-chat-app?utm_source=rss1.0mainlinkanon&utm_medium=feed,Unknown,https://rss.slashdot.org/Slashdot/slashdot
"Google Photos Turns 10 With Major Editor Redesign, QR Code Sharing",https://tech.slashdot.org/story/25/05/28/1940259/google-photos-turns-10-with-major-editor-redesign-qr-code-sharing?utm_source=rss1.0mainlinkanon&utm_medium=feed,Unknown,https://rss.slashdot.org/Slashdot/slashdot
Japanese Authorities Refer 'Spoiler Website' Operators To Prosecutors in Rare Corporate Copyright Case,https://slashdot.org/story/25/05/28/111250/japanese-authorities-refer-spoiler-website-operators-to-prosecutors-in-rare-corporate-copyright-case?utm_source=rss1.0mainlinkanon&utm_medium=feed,Unknown,https://rss.slashdot.org/Slashdot/slashdot
"80% Chance of Record Heat in Coming Years, Climate Agencies Forecast",https://news.slashdot.org/story/25/05/28/1616255/80-chance-of-record-heat-in-coming-years-climate-agencies-forecast?utm_source=rss1.0mainlinkanon&utm_medium=feed,Unknown,https://rss.slashdot.org/Slashdot/slashdot
The Hobby Computer Culture,https://it.slashdot.org/story/25/05/28/126210/the-hobby-computer-culture?utm_source=rss1.0mainlinkanon&utm_medium=feed,Unknown,https://rss.slashdot.org/Slashdot/slashdot
Elon Musk steps away from the White House,https://www.theverge.com/news/676224/elon-musk-leaves-doge-white-house-trump,2025-05-29T05:27:17-04:00,https://www.theverge.com/rss/index.xml
Windows 11 gets some much-needed HDR improvements,https://www.theverge.com/news/676205/microsoft-windows-11-hdr-streaming-video-improvements,2025-05-29T05:27:06-04:00,https://www.theverge.com/rss/index.xml
A Kaiser Permanente systems outage has pharmacies relying on pen and paper,https://www.theverge.com/news/676141/kaiser-permanente-outage-pharmacies-pen-paper,2025-05-28T18:56:01-04:00,https://www.theverge.com/rss/index.xml
Here are the best robot vacuum deals available right now,https://www.theverge.com/24350561/best-robot-vacuum-mop-irobot-roomba-eufy-roborock-deals-sale,2025-05-28T18:27:46-04:00,https://www.theverge.com/rss/index.xml
Tile trackers are being fully integrated into Life360,https://www.theverge.com/news/675912/tile-bluetooth-trackers-fully-integrated-with-life360-app,2025-05-28T17:23:46-04:00,https://www.theverge.com/rss/index.xml
Google says Instagram fixed a battery drain issue on Android,https://www.theverge.com/news/676032/google-android-instagram-battery-drain-update-fix,2025-05-28T16:30:52-04:00,https://www.theverge.com/rss/index.xml
Tesla’s iPhone app now supports Live Activities for Supercharging,https://www.theverge.com/news/676070/tesla-supercharger-apple-iphone-live-activites-status-child,2025-05-28T16:15:51-04:00,https://www.theverge.com/rss/index.xml
These new Switch 2 accessories are already discounted,https://www.theverge.com/tech/675808/nintendo-switch-2-hori-accessory-deal-sale,2025-05-28T16:03:42-04:00,https://www.theverge.com/rss/index.xml
Spotify is adding a Following feed for podcasts,https://www.theverge.com/news/676024/spotify-podcasts-following-feed-home-recommendations,2025-05-28T15:53:26-04:00,https://www.theverge.com/rss/index.xml
EA cancels Black Panther game,https://www.theverge.com/news/675923/black-panther-cancelled-cliffhanger-studios-shut-down-ea,2025-05-28T15:46:32-04:00,https://www.theverge.com/rss/index.xml
